{
    "@context": ["https://dlt.mobi/mobility-schema"],
    "type": [
        "RevocationList2020Status"
      ],
      "revocationListIndex": "23323",
      "revocationListCredential": "https://example.com/credentials/status/?queryID=0xFd5FEB812fFa20bEBDcBCD63dC11e96A7A1D59c14fAbEAF9c55D006Ac9DEac3B"
  }